[{"name":"Giovanni","title":"Team GO Rocket Boss","type":"","slots":[[{"name":"Persian","image":"https://pokemn.quest/pokemon/053-persian/pm53.icon.png","types":["normal"],"weaknesses":{"double":[],"single":["fighting"]},"isEncounter":false,"canBeShiny":false,"imageWidth":134,"imageHeight":146,"imageType":"png"}],[{"name":"Machamp","image":"https://pokemn.quest/pokemon/068-machamp/pm68.icon.png","types":["fighting"],"weaknesses":{"double":[],"single":["flying","psychic","fairy"]},"isEncounter":false,"canBeShiny":false,"imageWidth":147,"imageHeight":183,"imageType":"png"},{"name":"Kangaskhan","image":"https://pokemn.quest/pokemon/115-kangaskhan/pm115.icon.png","types":["normal"],"weaknesses":{"double":[],"single":["fighting"]},"isEncounter":false,"canBeShiny":false,"imageWidth":204,"imageHeight":181,"imageType":"png"},{"name":"Rhyperior","image":"https://pokemn.quest/pokemon/464-rhyperior/pm464.icon.png","types":["ground","rock"],"weaknesses":{"double":["water","grass"],"single":["ice","fighting","ground","steel"]},"isEncounter":false,"canBeShiny":false,"imageWidth":237,"imageHeight":206,"imageType":"png"}],[{"name":"Thundurus (Incarnate)","image":"https://pokemn.quest/pokemon/642-thundurus/pm642.fINCARNATE.icon.png","types":["electric","flying"],"weaknesses":{"double":[],"single":["ice","rock"]},"isEncounter":true,"canBeShiny":true,"imageWidth":173,"imageHeight":203,"imageType":"png"}]]},{"name":"Cliff","title":"Team GO Rocket Leader","type":"","slots":[[{"name":"Magikarp","image":"https://pokemn.quest/pokemon/129-magikarp/pm129.icon.png","types":["water"],"weaknesses":{"double":[],"single":["grass","electric"]},"isEncounter":true,"canBeShiny":true,"imageWidth":112,"imageHeight":83,"imageType":"png"}],[{"name":"Cradily","image":"https://pokemn.quest/pokemon/346-cradily/pm346.icon.png","types":["rock","grass"],"weaknesses":{"double":[],"single":["ice","fighting","bug","steel"]},"isEncounter":false,"canBeShiny":false,"imageWidth":123,"imageHeight":175,"imageType":"png"},{"name":"Annihilape","image":"https://pokemn.quest/pokemon/979-annihilape/pm979.icon.png","types":["fighting","ghost"],"weaknesses":{"double":[],"single":["flying","psychic","ghost","fairy"]},"isEncounter":false,"canBeShiny":false,"imageWidth":193,"imageHeight":218,"imageType":"png"},{"name":"Skarmory","image":"https://pokemn.quest/pokemon/227-skarmory/pm227.icon.png","types":["steel","flying"],"weaknesses":{"double":[],"single":["fire","electric"]},"isEncounter":false,"canBeShiny":false,"imageWidth":192,"imageHeight":133,"imageType":"png"}],[{"name":"Camerupt","image":"https://pokemn.quest/pokemon/323-camerupt/pm323.icon.png","types":["fire","ground"],"weaknesses":{"double":["water"],"single":["ground"]},"isEncounter":false,"canBeShiny":false,"imageWidth":179,"imageHeight":180,"imageType":"png"},{"name":"Tyranitar","image":"https://pokemn.quest/pokemon/248-tyranitar/pm248.icon.png","types":["rock","dark"],"weaknesses":{"double":["fighting"],"single":["water","grass","ground","bug","steel","fairy"]},"isEncounter":false,"canBeShiny":false,"imageWidth":150,"imageHeight":202,"imageType":"png"},{"name":"Gallade","image":"https://pokemn.quest/pokemon/475-gallade/pm475.icon.png","types":["psychic","fighting"],"weaknesses":{"double":[],"single":["flying","ghost","fairy"]},"isEncounter":false,"canBeShiny":false,"imageWidth":100,"imageHeight":187,"imageType":"png"}]]},{"name":"Arlo","title":"Team GO Rocket Leader","type":"","slots":[[{"name":"Mawile","image":"https://pokemn.quest/pokemon/303-mawile/pm303.icon.png","types":["steel","fairy"],"weaknesses":{"double":[],"single":["fire","ground"]},"isEncounter":true,"canBeShiny":true,"imageWidth":142,"imageHeight":102,"imageType":"png"}],[{"name":"Slowbro","image":"https://pokemn.quest/pokemon/080-slowbro/pm80.icon.png","types":["water","psychic"],"weaknesses":{"double":[],"single":["electric","grass","bug","ghost","dark"]},"isEncounter":false,"canBeShiny":false,"imageWidth":205,"imageHeight":149,"imageType":"png"},{"name":"Steelix","image":"https://pokemn.quest/pokemon/208-steelix/pm208.icon.png","types":["steel","ground"],"weaknesses":{"double":[],"single":["fire","water","fighting","ground"]},"isEncounter":false,"canBeShiny":false,"imageWidth":211,"imageHeight":200,"imageType":"png"},{"name":"Golurk","image":"https://pokemn.quest/pokemon/623-golurk/pm623.icon.png","types":["ground","ghost"],"weaknesses":{"double":[],"single":["water","grass","ice","ghost","dark"]},"isEncounter":false,"canBeShiny":false,"imageWidth":205,"imageHeight":231,"imageType":"png"}],[{"name":"Scizor","image":"https://pokemn.quest/pokemon/212-scizor/pm212.icon.png","types":["bug","steel"],"weaknesses":{"double":["fire"],"single":[]},"isEncounter":false,"canBeShiny":false,"imageWidth":143,"imageHeight":201,"imageType":"png"},{"name":"Alakazam","image":"https://pokemn.quest/pokemon/065-alakazam/pm65.icon.png","types":["psychic"],"weaknesses":{"double":[],"single":["bug","ghost","dark"]},"isEncounter":false,"canBeShiny":false,"imageWidth":155,"imageHeight":175,"imageType":"png"},{"name":"Charizard","image":"https://pokemn.quest/pokemon/006-charizard/pm6.icon.png","types":["fire","flying"],"weaknesses":{"double":["rock"],"single":["water","electric"]},"isEncounter":false,"canBeShiny":false,"imageWidth":216,"imageHeight":152,"imageType":"png"}]]},{"name":"Sierra","title":"Team GO Rocket Leader","type":"","slots":[[{"name":"Hoppip","image":"https://pokemn.quest/pokemon/187-hoppip/pm187.icon.png","types":["grass","flying"],"weaknesses":{"double":["ice"],"single":["fire","poison","flying","rock"]},"isEncounter":true,"canBeShiny":true,"imageWidth":153,"imageHeight":104,"imageType":"png"}],[{"name":"Ferrothorn","image":"https://pokemn.quest/pokemon/598-ferrothorn/pm598.icon.png","types":["grass","steel"],"weaknesses":{"double":["fire"],"single":["fighting"]},"isEncounter":false,"canBeShiny":false,"imageWidth":222,"imageHeight":124,"imageType":"png"},{"name":"Flygon","image":"https://pokemn.quest/pokemon/330-flygon/pm330.icon.png","types":["ground","dragon"],"weaknesses":{"double":["ice"],"single":["dragon","fairy"]},"isEncounter":false,"canBeShiny":false,"imageWidth":228,"imageHeight":170,"imageType":"png"},{"name":"Blastoise","image":"https://pokemn.quest/pokemon/009-blastoise/pm9.icon.png","types":["water"],"weaknesses":{"double":[],"single":["grass","electric"]},"isEncounter":false,"canBeShiny":false,"imageWidth":171,"imageHeight":153,"imageType":"png"}],[{"name":"Houndoom","image":"https://pokemn.quest/pokemon/229-houndoom/pm229.icon.png","types":["dark","fire"],"weaknesses":{"double":[],"single":["water","fighting","ground","rock"]},"isEncounter":false,"canBeShiny":false,"imageWidth":110,"imageHeight":189,"imageType":"png"},{"name":"Steelix","image":"https://pokemn.quest/pokemon/208-steelix/pm208.icon.png","types":["steel","ground"],"weaknesses":{"double":[],"single":["fire","water","fighting","ground"]},"isEncounter":false,"canBeShiny":false,"imageWidth":211,"imageHeight":200,"imageType":"png"},{"name":"Milotic","image":"https://pokemn.quest/pokemon/350-milotic/pm350.icon.png","types":["water"],"weaknesses":{"double":[],"single":["grass","electric"]},"isEncounter":false,"canBeShiny":false,"imageWidth":228,"imageHeight":215,"imageType":"png"}]]},{"name":"Normal-type Male Grunt","title":"Team GO Rocket Grunt","type":"normal","slots":[[{"name":"Teddiursa","image":"https://pokemn.quest/pokemon/216-teddiursa/pm216.icon.png","types":["normal"],"weaknesses":{"double":[],"single":["fighting"]},"isEncounter":true,"canBeShiny":true,"imageWidth":89,"imageHeight":115,"imageType":"png"},{"name":"Meowth","image":"https://pokemn.quest/pokemon/052-meowth/pm52.icon.png","types":["normal"],"weaknesses":{"double":[],"single":["fighting"]},"isEncounter":true,"canBeShiny":true,"imageWidth":83,"imageHeight":101,"imageType":"png"},{"name":"Swablu","image":"https://pokemn.quest/pokemon/333-swablu/pm333.icon.png","types":["normal","flying"],"weaknesses":{"double":[],"single":["electric","ice","rock"]},"isEncounter":true,"canBeShiny":true,"imageWidth":154,"imageHeight":82,"imageType":"png"}],[{"name":"Loudred","image":"https://pokemn.quest/pokemon/294-loudred/pm294.icon.png","types":["normal"],"weaknesses":{"double":[],"single":["fighting"]},"isEncounter":false,"canBeShiny":false,"imageWidth":142,"imageHeight":139,"imageType":"png"},{"name":"Starly","image":"https://pokemn.quest/pokemon/396-starly/pm396.icon.png","types":["normal","flying"],"weaknesses":{"double":[],"single":["electric","ice","rock"]},"isEncounter":false,"canBeShiny":false,"imageWidth":76,"imageHeight":94,"imageType":"png"},{"name":"Rattata","image":"https://pokemn.quest/pokemon/019-rattata/pm19.icon.png","types":["normal"],"weaknesses":{"double":[],"single":["fighting"]},"isEncounter":false,"canBeShiny":false,"imageWidth":80,"imageHeight":120,"imageType":"png"}],[{"name":"Swellow","image":"https://pokemn.quest/pokemon/277-swellow/pm277.icon.png","types":["normal","flying"],"weaknesses":{"double":[],"single":["electric","ice","rock"]},"isEncounter":false,"canBeShiny":false,"imageWidth":201,"imageHeight":47,"imageType":"png"},{"name":"Kangaskhan","image":"https://pokemn.quest/pokemon/115-kangaskhan/pm115.icon.png","types":["normal"],"weaknesses":{"double":[],"single":["fighting"]},"isEncounter":false,"canBeShiny":false,"imageWidth":204,"imageHeight":181,"imageType":"png"},{"name":"Ursaring","image":"https://pokemn.quest/pokemon/217-ursaring/pm217.icon.png","types":["normal"],"weaknesses":{"double":[],"single":["fighting"]},"isEncounter":false,"canBeShiny":false,"imageWidth":141,"imageHeight":192,"imageType":"png"}]]},{"name":"Fire-type Female Grunt","title":"Team GO Rocket Grunt","type":"fire","slots":[[{"name":"Vulpix","image":"https://pokemn.quest/pokemon/037-vulpix/pm37.icon.png","types":["fire"],"weaknesses":{"double":[],"single":["water","ground","rock"]},"isEncounter":true,"canBeShiny":true,"imageWidth":120,"imageHeight":114,"imageType":"png"},{"name":"Litwick","image":"https://pokemn.quest/